<xs:schema attributeFormDefault="unqualified" elementFormDefault="qualified" xmlns:xs="http://www.w3.org/2001/XMLSchema">
  <xs:element name="resume">
    <xs:complexType>
      <xs:sequence>
        <xs:element name="personal">
          <xs:annotation>
            <xs:documentation> Personal Information </xs:documentation>
          </xs:annotation>
          <xs:complexType>
            <xs:sequence>
              <xs:element type="xs:string" name="name"/>
              <xs:element type="xs:string" name="address"/>
              <xs:element type="xs:string" name="phone"/>
              <xs:element type="xs:string" name="email"/>
              <xs:element type="xs:string" name="description"/>
            </xs:sequence>
          </xs:complexType>
        </xs:element>
        <xs:element name="education">
          <xs:annotation>
            <xs:documentation> University Degree </xs:documentation>
          </xs:annotation>
          <xs:complexType>
            <xs:sequence>
              <xs:element name="school">
                <xs:complexType>
                  <xs:sequence>
                    <xs:element type="xs:string" name="name"/>
                    <xs:element type="xs:string" name="address"/>
                    <xs:element type="xs:string" name="degree"/>
                    <xs:element type="xs:string" name="date"/>
                  </xs:sequence>
                </xs:complexType>
              </xs:element>
            </xs:sequence>
          </xs:complexType>
        </xs:element>
        <xs:element name="experience">
          <xs:annotation>
            <xs:documentation> Work Experience </xs:documentation>
          </xs:annotation>
          <xs:complexType>
            <xs:sequence>
              <xs:element name="work" maxOccurs="unbounded" minOccurs="0">
                <xs:complexType>
                  <xs:sequence>
                    <xs:element type="xs:string" name="title"/>
                    <xs:element type="xs:string" name="organization"/>
                    <xs:element type="xs:string" name="date"/>
                    <xs:element type="xs:string" name="description"/>
                  </xs:sequence>
                </xs:complexType>
              </xs:element>
            </xs:sequence>
          </xs:complexType>
        </xs:element>
        <xs:element name="skills">
          <xs:annotation>
            <xs:documentation> Work Skills </xs:documentation>
          </xs:annotation>
          <xs:complexType>
            <xs:sequence>
              <xs:element type="xs:string" name="expert"/>
              <xs:element type="xs:string" name="intermediate"/>
              <xs:element type="xs:string" name="software_engineering"/>
              <xs:element type="xs:string" name="tools"/>
            </xs:sequence>
          </xs:complexType>
        </xs:element>
      </xs:sequence>
    </xs:complexType>
  </xs:element>
</xs:schema>